{
  "name": "Example Title",
  "platform": "example_value",
  "domains": [],
  "enabled": true,
  "development": true,
  "privacy": "example_value",
  "ssl_enabled": true,
  "rule_component_sequencing_enabled": true,
  "undefined_vars_return_empty": true,
  "token": "example_value",
  "created_at": "2026-01-15T10:30:00Z",
  "updated_at": "2026-01-15T10:30:00Z"
}